{
  "schema": "modelbus.consumer_surface_admission.v1",
  "generated_at_utc": "2026-04-13T08:31:49Z",
  "consumer_id": "datapulse",
  "source_profile": "docs/examples/consumer-profile.datapulse.json",
  "source_release_status": "out/assured_refresh_20260413_041944/release_status.json",
  "release_window": {
    "generated_at_utc": "2026-04-13T04:20:56Z",
    "release_level": "assured",
    "assured_verdict": "pass",
    "constitutional_semantics": "ASSURED-ACTIVE"
  },
  "surface_admissions": [
    {
      "surface_id": "mission_suggest",
      "requested_alias": "dp.mission.suggest",
      "admission_status": "admitted",
      "admitted_alias": "dp.mission.suggest",
      "mode_admission": {
        "off": "manual_only",
        "assist": "admitted",
        "review": "admitted"
      },
      "schema_contract": "datapulse_ai_watch_suggestion.v1",
      "manual_fallback": "manual_or_deterministic_behavior",
      "consumer_boundary": "bounded_scope_suggestions_only",
      "degraded_result_allowed": true,
      "must_expose_runtime_facts": [
        "served_by_alias",
        "request_id",
        "fallback_used",
        "degraded",
        "schema_valid",
        "manual_override_required"
      ],
      "runtime_hit": {
        "status": "not_provided",
        "ok": null,
        "request_id_present": false,
        "request_ids": {},
        "http_code": null,
        "body_model": "",
        "client_request_id": "",
        "attempt_count": 0,
        "api_format": null,
        "structured_mode": null
      },
      "rejectable_gaps": []
    },
    {
      "surface_id": "triage_assist",
      "requested_alias": "dp.triage.assist",
      "admission_status": "admitted",
      "admitted_alias": "dp.triage.assist",
      "mode_admission": {
        "off": "manual_only",
        "assist": "admitted",
        "review": "admitted"
      },
      "schema_contract": "datapulse_ai_triage_explain.v1",
      "manual_fallback": "manual_or_deterministic_behavior",
      "consumer_boundary": "operator_review_queue_only",
      "degraded_result_allowed": true,
      "must_expose_runtime_facts": [
        "served_by_alias",
        "request_id",
        "fallback_used",
        "degraded",
        "schema_valid",
        "manual_override_required"
      ],
      "runtime_hit": {
        "status": "not_provided",
        "ok": null,
        "request_id_present": false,
        "request_ids": {},
        "http_code": null,
        "body_model": "",
        "client_request_id": "",
        "attempt_count": 0,
        "api_format": null,
        "structured_mode": null
      },
      "rejectable_gaps": []
    },
    {
      "surface_id": "claim_draft",
      "requested_alias": "dp.claim.draft",
      "admission_status": "admitted",
      "admitted_alias": "dp.claim.draft",
      "mode_admission": {
        "off": "manual_only",
        "assist": "admitted",
        "review": "admitted"
      },
      "schema_contract": "datapulse_ai_claim_draft.v1",
      "manual_fallback": "manual_or_deterministic_behavior",
      "consumer_boundary": "review_before_claim_finalization",
      "degraded_result_allowed": false,
      "must_expose_runtime_facts": [
        "served_by_alias",
        "request_id",
        "fallback_used",
        "degraded",
        "schema_valid",
        "manual_override_required"
      ],
      "runtime_hit": {
        "status": "not_provided",
        "ok": null,
        "request_id_present": false,
        "request_ids": {},
        "http_code": null,
        "body_model": "",
        "client_request_id": "",
        "attempt_count": 0,
        "api_format": null,
        "structured_mode": null
      },
      "rejectable_gaps": []
    },
    {
      "surface_id": "report_draft",
      "requested_alias": "dp.report.draft",
      "admission_status": "rejected",
      "admitted_alias": "",
      "mode_admission": {
        "off": "manual_only",
        "assist": "rejected",
        "review": "rejected"
      },
      "schema_contract": null,
      "manual_fallback": "manual_or_deterministic_behavior",
      "consumer_boundary": "blocked_until_structured_contract",
      "degraded_result_allowed": false,
      "must_expose_runtime_facts": [
        "served_by_alias",
        "request_id",
        "fallback_used",
        "degraded",
        "schema_valid",
        "manual_override_required"
      ],
      "runtime_hit": {
        "status": "not_provided",
        "ok": null,
        "request_id_present": false,
        "request_ids": {},
        "http_code": null,
        "body_model": "",
        "client_request_id": "",
        "attempt_count": 0,
        "api_format": null,
        "structured_mode": null
      },
      "rejectable_gaps": [
        {
          "gap_id": "missing_structured_contract",
          "blocking": true,
          "reason": "surface is blocked_until_contract and has no admitted structured contract"
        }
      ]
    },
    {
      "surface_id": "delivery_summary",
      "requested_alias": "dp.delivery.summary",
      "admission_status": "admitted",
      "admitted_alias": "dp.delivery.summary",
      "mode_admission": {
        "off": "manual_only",
        "assist": "admitted",
        "review": "admitted"
      },
      "schema_contract": "datapulse_ai_delivery_summary.v1",
      "manual_fallback": "manual_or_deterministic_behavior",
      "consumer_boundary": "operator_visible_delivery_digest_only",
      "degraded_result_allowed": true,
      "must_expose_runtime_facts": [
        "served_by_alias",
        "request_id",
        "fallback_used",
        "degraded",
        "schema_valid",
        "manual_override_required"
      ],
      "runtime_hit": {
        "status": "not_provided",
        "ok": null,
        "request_id_present": false,
        "request_ids": {},
        "http_code": null,
        "body_model": "",
        "client_request_id": "",
        "attempt_count": 0,
        "api_format": null,
        "structured_mode": null
      },
      "rejectable_gaps": []
    }
  ]
}
